"THRK48ZB","journalArticle","2023","Song, Gefei; Plumlee, Pierce; Ahn, Ju Young; Wong, Stephen Tc; Zhao, Hong","Translational strategies and systems biology insights for blood-brain barrier opening and delivery in brain tumors and Alzheimer's disease.","Biomedicine & pharmacotherapy = Biomedecine & pharmacotherapie","","1950-6007 0753-3322","10.1016/j.biopha.2023.115450","","The blood-brain barrier (BBB) plays a critical role in determining the effectiveness of systemic treatments for brain diseases. Over the years, several  innovative approaches in BBB opening and drug delivery have been developed and  progressed into clinical testing phases, including focused ultrasound (FUS) with  circulating microbubbles, mannitol-facilitated delivery of anti-neoplastic drugs,  receptor-mediated transcytosis (RMT) by antibody-drug conjugates (ADCs), and  viral vectors for gene therapy. We provided a comprehensive review of the most  recent clinical applications of these approaches in managing brain tumors and  Alzheimer's disease (AD), two major devastating brain diseases. Moreover, the  spatial-temporal molecular heterogeneity of the BBB under disease states  emphasized the importance of utilizing emerging spatial systems biology  approaches to unravel novel targets for intervention within BBB and tailor  strategies for enhancing drug delivery to the brain. SEARCH STRATEGY AND  SELECTION CRITERIA: Data for this Review were identified by searches of  clinicaltrials.gov, MEDLINE, Current Contents, PubMed, and references from  relevant articles using the search terms ""blood-brain barrier"", ""CNS drug  delivery"", ""BBB modulation"", ""clinical trials"", ""systems biology"", ""primary or  metastatic brain tumors"", ""Alzheimer's disease"". Abstracts and reports from  meetings were included only when they related directly to previously published  work. Only articles published in English between 1980 and 2023 were included.","2023-11","2024-03-06 16:57:30","2024-03-06T16:57:30Z","","115450","","","167","","Biomed Pharmacother","","","","","","","","eng","Copyright © 2023 The Authors. Published by Elsevier Masson SAS.. All rights reserved.","","","","","","Place: France PMID: 37703663  PMCID: PMC10591819","","","","*Alzheimer Disease/drug therapy/pathology; *Brain Neoplasms/drug therapy/pathology; Alzheimer’s disease; Blood-Brain Barrier/pathology; Blood-brain barrier opening; Brain; Brain tumors; CNS drug delivery; Clinical studies; Drug Delivery Systems; Humans; Microbubbles; Systems Biology; Systems biology","","","","","","","","","","","","","","","","","","","","","","","","","","","","","","","","","","","","","","","","","","","","","","",""
"Z5IFIIB9","journalArticle","2023","Ilham, Sheikh Jawad; Kiani, Mehdi","Towards High-Resolution Ultrasound Neuromodulation With Crossed-Beam Phased Arrays.","IEEE transactions on biomedical circuits and systems","","1940-9990 1932-4545","10.1109/TBCAS.2023.3285724","","Transcranial focused ultrasound stimulation (tFUS) has emerged as a potential noninvasive therapeutic technology. Due to skull attenuations at high ultrasound  (US) frequencies, successful tFUS with sufficient penetration depth requires  sub-MHz US waves, leading to relatively poor stimulation specificity particularly  in the axial direction (perpendicular to the US transducer). This shortcoming can  potentially be overcome by utilizing two individual US beams properly crossed in  time and space. For large-scale tFUS, a phased array is also required to  dynamically steer focused US beams at desired neural targets. This article  presents the theoretical foundation and optimization (through a wave-propagation  simulator) of crossed-beam formation using two US phased arrays. It also  experimentally validates crossed-beam formation with two custom-made 32-element  phased arrays (operating at 555.5 kHz) positioned relatively at different angles.  In measurements, the sub-MHz crossed-beam phased arrays achieved 0.8/3.4 mm  lateral/axial resolution at a focal distance of ∼ 46 mm, compared to the  lateral/axial resolution of 3.4/26.8 mm of the individual phased array at 50 mm  focal distance (∼ 28.4-fold improvement in reducing the main focal zone area).  The crossed-beam formation in the presence of a rat skull and a tissue layer was  also validated in the measurements.","2023-06","2024-03-06 16:57:30","2024-03-06T16:57:30Z","","534-546","","3","17","","IEEE Trans Biomed Circuits Syst","","","","","","","","eng","","","","","","","Place: United States PMID: 37310841","","","","*Transducers; *Ultrasonic Therapy; Animals; Head; Rats; Skull/diagnostic imaging; Ultrasonography","","","","","","","","","","","","","","","","","","","","","","","","","","","","","","","","","","","","","","","","","","","","","","",""
"Z6HSPDXC","journalArticle","2023","Zhu, Jiejun; Xian, Quanxiang; Hou, Xuandi; Wong, Kin Fung; Zhu, Tingting; Chen, Zihao; He, Dongming; Kala, Shashwati; Murugappan, Suresh; Jing, Jianing; Wu, Yong; Zhao, Xinyi; Li, Danni; Guo, Jinghui; Qiu, Zhihai; Sun, Lei","The mechanosensitive ion channel Piezo1 contributes to ultrasound neuromodulation.","Proceedings of the National Academy of Sciences of the United States of America","","1091-6490 0027-8424","10.1073/pnas.2300291120","","Transcranial low-intensity ultrasound is a promising neuromodulation modality, with the advantages of noninvasiveness, deep penetration, and high spatiotemporal  accuracy. However, the underlying biological mechanism of ultrasonic  neuromodulation remains unclear, hindering the development of efficacious  treatments. Here, the well-known Piezo1 was studied through a conditional  knockout mouse model as a major mediator for ultrasound neuromodulation ex vivo  and in vivo. We showed that Piezo1 knockout (P1KO) in the right motor cortex of  mice significantly reduced ultrasound-induced neuronal calcium responses, limb  movement, and muscle electromyogram (EMG) responses. We also detected higher  Piezo1 expression in the central amygdala (CEA), which was found to be more  sensitive to ultrasound stimulation than the cortex was. Knocking out the Piezo1  in CEA neurons showed a significant reduction of response under ultrasound  stimulation, while knocking out astrocytic Piezo1 showed no-obvious changes in  neuronal responses. Additionally, we excluded an auditory confound by monitoring  auditory cortical activation and using smooth waveform ultrasound with randomized  parameters to stimulate P1KO ipsilateral and contralateral regions of the same  brain and recording evoked movement in the corresponding limb. Thus, we  demonstrate that Piezo1 is functionally expressed in different brain regions and  that it is an important mediator of ultrasound neuromodulation in the brain,  laying the ground for further mechanistic studies of ultrasound.","2023-05-02","2024-03-06 16:57:30","2024-03-06T16:57:30Z","","e2300291120","","18","120","","Proc Natl Acad Sci U S A","","","","","","","","eng","","","","","","","Place: United States PMID: 37098060  PMCID: PMC10161134","","","","*Auditory Cortex/metabolism; *Brain/physiology; Animals; Ion Channels/genetics/metabolism; Mice; Mice, Knockout; Neurons/metabolism; Piezo1; Ultrasonography; focused ultrasound; mechanosensitive ion channels; sonogenetics; transcranial ultrasound neuromodulation","","","","","","","","","","","","","","","","","","","","","","","","","","","","","","","","","","","","","","","","","","","","","","",""
"SCTBM6YE","journalArticle","2023","Song, Xizi; Huang, Peishan; Chen, Xinrui; Xu, Minpeng; Ming, Dong","The frontooccipital interaction mechanism of high-frequency acoustoelectric signal.","Cerebral cortex (New York, N.Y. : 1991)","","1460-2199 1047-3211","10.1093/cercor/bhad306","","Based on acoustoelectric effect, acoustoelectric brain imaging has been proposed, which is a high spatiotemporal resolution neural imaging method. At the focal  spot, brain electrical activity is encoded by focused ultrasound, and  corresponding high-frequency acoustoelectric signal is generated. Previous  studies have revealed that acoustoelectric signal can also be detected in other  non-focal brain regions. However, the processing mechanism of acoustoelectric  signal between different brain regions remains sparse. Here, with acoustoelectric  signal generated in the left primary visual cortex, we investigated the spatial  distribution characteristics and temporal propagation characteristics of  acoustoelectric signal in the transmission. We observed a strongest transmission  strength within the frontal lobe, and the global temporal statistics indicated  that the frontal lobe features in acoustoelectric signal transmission. Then,  cross-frequency phase-amplitude coupling was used to investigate the coordinated  activity in the AE signal band range between frontal and occipital lobes. The  results showed that intra-structural cross-frequency coupling and  cross-structural coupling co-occurred between these two lobes, and, accordingly,  high-frequency brain activity in the frontal lobe was effectively coordinated by  distant occipital lobe. This study revealed the frontooccipital long-range  interaction mechanism of acoustoelectric signal, which is the foundation of  improving the performance of acoustoelectric brain imaging.","2023-10-14","2024-03-06 16:57:30","2024-03-06T16:57:30Z","","10723-10735","","21","33","","Cereb Cortex","","","","","","","","eng","© The Author(s) 2023. Published by Oxford University Press. All rights reserved. For permissions, please e-mail: journals.permission@oup.com.","","","","","","Place: United States PMID: 37724433","","","","*Brain; *Frontal Lobe/diagnostic imaging; Brain Mapping; amplitude correlation; hidden Markov model; high-frequency oscillations; partial directed coherence; phase amplitude coupling","","","","","","","","","","","","","","","","","","","","","","","","","","","","","","","","","","","","","","","","","","","","","","",""
"H9GHPBP3","journalArticle","2023","Shu, Chang; Lim, Maria; Fang, Adam","Transarterial Embolization and Percutaneous Ablation of Primary and Metastatic Soft Tissue Tumors.","Life (Basel, Switzerland)","","2075-1729","10.3390/life13071485","","Soft tissue tumors (STTs) include a range of benign and malignant tumors originating from soft tissues. Transarterial and percutaneous therapies are  image-guided and minimally invasive approaches for managing primary and  metastatic STTs. The objective of this review is to discuss transarterial and  percutaneous therapies by examining the current literature, including  indications, patient selection, safety, and effectiveness. Transarterial  therapies (e.g., transarterial bland embolization and transarterial  chemoembolization) involve the delivery of either embolic or chemotherapeutic  particles using a catheter into arteries feeding the tumor, resulting in  localized tumor destruction. Percutaneous therapies (e.g., radiofrequency  ablation, cryoablation, irreversible electroporation, laser ablation, and  magnetic resonance-guided high-intensity focused ultrasound) involve the delivery  of either hot or cold temperatures, electrical current, laser, or ultrasound to  specifically target tumor cells. Both therapies have been shown to be safe and  effective for reducing morbidity and local control of STTs, specifically in  patients who are surgically inoperable or who are unresponsive to conventional  therapies. Accurate diagnosis, staging, and histological subtype identification  are crucial for treatment selection. A multidisciplinary approach, a thorough  understanding of tissue anatomy and surrounding structures, as well as  individualized strategies based on assessment are essential for optimal patient  care.","2023-06-30","2024-03-06 16:57:30","2024-03-06T16:57:30Z","","","","7","13","","Life (Basel)","","","","","","","","eng","","","","","","","Place: Switzerland PMID: 37511864  PMCID: PMC10381432","","","","TACE; ablation; cryoablation; embolization; interventional radiology; percutaneous; sarcomas; soft tissue; transarterial; tumors","","","","","","","","","","","","","","","","","","","","","","","","","","","","","","","","","","","","","","","","","","","","","","",""
"A5JLVWRH","journalArticle","2023","Sridharan, Badrinathan; Sharma, Alok Kumar; Lim, Hae Gyun","The Role of Ultrasound in Cancer and Cancer-Related Pain-A Bibliometric Analysis and Future Perspectives.","Sensors (Basel, Switzerland)","","1424-8220","10.3390/s23167290","","Ultrasound has a deep penetrating ability with minimal or no tissue injury, while cancer-mediated complications during diagnosis, therapy, and surgery have become  a serious challenge for clinicians and lead to the severity of the primary  condition (cancer). The current study highlights the importance of ultrasound  imaging and focused ultrasound therapy during cancer diagnosis, pain reduction,  guidance for surgical resection of cancer, and the effectiveness of chemotherapy.  We performed the bibliometric analysis on research domains involving ultrasound,  cancer management, pain, and other challenges (chemotherapy, surgical guidance,  and postoperative care), to observe the trend by which the research field has  grown over the years and propose a possible future trend. The data was obtained  from the Web of Science, processed, and exported as plain text files for analysis  in the Bibliometrix R web interface using the Biblioshiny package. A total of  3248 documents were identified from 1100 journal sources. A total of 390 articles  were published in 2022, with almost a 100% growth rate from previous years. Based  on the various network analysis, we conclude that the outcome of the constant  research in this domain will result in better patient care during the management  of various diseases, including cancer and other co-morbidities.","2023-08-21","2024-03-06 16:57:30","2024-03-06T16:57:30Z","","","","16","23","","Sensors (Basel)","","","","","","","","eng","","","","","","","Place: Switzerland PMID: 37631826  PMCID: PMC10458834","","","","*Cancer Pain; *Neoplasms/diagnostic imaging; Bibliometrics; Humans; Pain; Ultrasonography; acousitc waves; bibliometry; nociception; pain; tumor; ultrasound","","","","","","","","","","","","","","","","","","","","","","","","","","","","","","","","","","","","","","","","","","","","","","",""
"2SS9QAAC","journalArticle","2023","Yaakub, Siti N.; White, Tristan A.; Roberts, Jamie; Martin, Eleanor; Verhagen, Lennart; Stagg, Charlotte J.; Hall, Stephen; Fouragnan, Elsa F.","Transcranial focused ultrasound-mediated neurochemical and functional connectivity changes in deep cortical regions in humans.","Nature communications","","2041-1723","10.1038/s41467-023-40998-0","","Low-intensity transcranial ultrasound stimulation (TUS) is an emerging non-invasive technique for focally modulating human brain function. The  mechanisms and neurochemical substrates underlying TUS neuromodulation in humans  and how these relate to excitation and inhibition are still poorly understood. In  24 healthy controls, we separately stimulated two deep cortical regions and  investigated the effects of theta-burst TUS, a protocol shown to increase  corticospinal excitability, on the inhibitory neurotransmitter gamma-aminobutyric  acid (GABA) and functional connectivity. We show that theta-burst TUS in humans  selectively reduces GABA levels in the posterior cingulate, but not the dorsal  anterior cingulate cortex. Functional connectivity increased following TUS in  both regions. Our findings suggest that TUS changes overall excitability by  reducing GABAergic inhibition and that changes in TUS-mediated neuroplasticity  last at least 50 mins after stimulation. The difference in TUS effects on the  posterior and anterior cingulate could suggest state- or location-dependency of  the TUS effect-both mechanisms increasingly recognized to influence the brain's  response to neuromodulation.","2023-09-01","2024-03-06 16:57:30","2024-03-06T16:57:30Z","","5318","","1","14","","Nat Commun","","","","","","","","eng","© 2023. Springer Nature Limited.","","","","","","Place: England PMID: 37658076  PMCID: PMC10474159","","","","*Gastropoda; Animals; Gyrus Cinguli/diagnostic imaging; Humans; Inhibition, Psychological; Light; gamma-Aminobutyric Acid","","","","","","","","","","","","","","","","","","","","","","","","","","","","","","","","","","","","","","","","","","","","","","",""
"CVFTDJEN","journalArticle","2023","Nili, Mohammad-Hossein H. K.; Esfahan, Shahrzad M.; Bagheri, Yamin; Vahabie, Abdol-Hossein; Sanayei, Mehdi; Ertiaei, Abolhassan; Shirani, Mohammad; Dehaqani, Mohammad-Reza A.; Rezayat, Ehsan","The variation of functional connectivity and activity before and after thalamotomy surgery (review).","Frontiers in human neuroscience","","1662-5161","10.3389/fnhum.2023.1108888","","Ablation surgeries are utilized to treat certain brain disorders. Recently, these surgeries have become more prevalent using techniques such as magnetic resonance  guided focused ultrasound (MRgFUS) ablation and Gamma knife thalamotomy (GKT).  However, as the thalamus plays a critical role in cognitive functions, the  potential impact of these surgeries on functional connectivity and cognition is a  matter of concern. Various approaches have been developed to locate the target  for ablation and also investigate changes in functional connectivity before and  after surgery. Functional magnetic resonance imaging (fMRI) and  electroencephalogram (EEG) are widely used methods for assessing changes in  functional connectivity and activity in clinical research. In this Review, we  summarize the use of fMRI and EEG in thalamotomy surgeries. Our analysis shows  that thalamotomy surgery can result in changes in functional connectivity in  motor-related, visuomotor, and default-mode networks, as detected by fMRI. EEG  data also indicate a reduction in over-activities observed in the preoperative  state.","2023","2024-03-06 16:57:30","2024-03-06T16:57:30Z","","1108888","","","17","","Front Hum Neurosci","","","","","","","","eng","Copyright © 2023 Nili, Esfahan, Bagheri, Vahabie, Sanayei, Ertiaei, Shirani, Dehaqani and Rezayat.","","","","","","Place: Switzerland PMID: 37187943  PMCID: PMC10175682","","","","EEG; ablation surgery; activity; fMRI; functional connectivity; thalamotomy","","","","","","","","","","","","","","","","","","","","","","","","","","","","","","","","","","","","","","","","","","","","","","",""
"PEYBU27D","journalArticle","2024","Siddiqi, Shan H.; Khosravani, Sanaz; Rolston, John D.; Fox, Michael D.","The future of brain circuit-targeted therapeutics.","Neuropsychopharmacology : official publication of the American College of Neuropsychopharmacology","","1740-634X 0893-133X","10.1038/s41386-023-01670-9","","The principle of targeting brain circuits has drawn increasing attention with the growth of brain stimulation treatments such as transcranial magnetic stimulation  (TMS), deep brain stimulation (DBS), and focused ultrasound (FUS). Each of these  techniques can effectively treat different neuropsychiatric disorders, but  treating any given disorder depends on choosing the right treatment target. Here,  we propose a three-phase framework for identifying and modulating these targets.  There are multiple approaches to identifying a target, including correlative  neuroimaging, retrospective optimization based on existing stimulation sites, and  lesion localization. These techniques can then be optimized using personalized  neuroimaging, physiological monitoring, and engagement of a specific brain state  using pharmacological or psychological interventions. Finally, a specific  stimulation modality or combination of modalities can be chosen after considering  the advantages and tradeoffs of each. While there is preliminary literature to  support different components of this framework, there are still many unanswered  questions. This presents an opportunity for the future growth of research and  clinical care in brain circuit therapeutics.","2024-01","2024-03-06 16:57:30","2024-03-06T16:57:30Z","","179-188","","1","49","","Neuropsychopharmacology","","","","","","","","eng","© 2023. The Author(s), under exclusive licence to American College of Neuropsychopharmacology.","","","","","","Place: England PMID: 37524752  PMCID: PMC10700386","","","","*Brain/diagnostic imaging/physiology; *Deep Brain Stimulation/methods; Neuroimaging/methods; Retrospective Studies; Transcranial Magnetic Stimulation/methods","","","","","","","","","","","","","","","","","","","","","","","","","","","","","","","","","","","","","","","","","","","","","","",""
"JC3WQV3Y","journalArticle","2023","Joutsa, Juho; Lipsman, Nir; Horn, Andreas; Cosgrove, G. Rees; Fox, Michael D.","The return of the lesion for localization and therapy.","Brain : a journal of neurology","","1460-2156 0006-8950","10.1093/brain/awad123","","Historically, pathological brain lesions provided the foundation for localization of symptoms and therapeutic lesions were used as a treatment for brain diseases.  New medications, functional neuroimaging and deep brain stimulation have led to a  decline in lesions in the past few decades. However, recent advances have  improved our ability to localize lesion-induced symptoms, including localization  to brain circuits rather than individual brain regions. Improved localization can  lead to more precise treatment targets, which may mitigate traditional advantages  of deep brain stimulation over lesions such as reversibility and tunability. New  tools for creating therapeutic brain lesions such as high intensity focused  ultrasound allow for lesions to be placed without a skin incision and are already  in clinical use for tremor. Although there are limitations, and caution is  warranted, improvements in lesion-based localization are refining our therapeutic  targets and improved technology is providing new ways to create therapeutic  lesions, which together may facilitate the return of the lesion.","2023-08-01","2024-03-06 16:57:30","2024-03-06T16:57:30Z","","3146-3155","","8","146","","Brain","","","","","","","","eng","© The Author(s) 2023. Published by Oxford University Press on behalf of the Guarantors of Brain.","","","","","","Place: England PMID: 37040563  PMCID: PMC10393408","","","","*Brain Diseases; *Nervous System Diseases; Brain Mapping; Brain/pathology; Humans; MRgFUS; Tremor; connectivity; lesion mapping; lesion network mapping; stroke","","","","","","","","","","","","","","","","","","","","","","","","","","","","","","","","","","","","","","","","","","","","","","",""
"E7A3Z6DD","journalArticle","2023","Blackmore, Daniel G.; Razansky, Daniel; Götz, Jürgen","Ultrasound as a versatile tool for short- and long-term improvement and monitoring of brain function.","Neuron","","1097-4199 0896-6273","10.1016/j.neuron.2023.02.018","","Treating the brain with focused ultrasound (FUS) at low intensities elicits diverse responses in neurons, astroglia, and the extracellular matrix. In  combination with intravenously injected microbubbles, FUS also opens the  blood-brain barrier (BBB) and facilitates focal drug delivery. However, an  incompletely understood cellular specificity and a wide parameter space currently  limit the optimal application of FUS in preclinical and human studies. In this  perspective, we discuss how different FUS modalities can be utilized to achieve  short- and long-term improvements, thereby potentially treating brain disorders.  We review the ongoing efforts to determine which parameters induce neuronal  inhibition versus activation and how mechanoreceptors and signaling cascades are  activated to induce long-term changes, including memory improvements. We suggest  that optimal FUS treatments may require different FUS modalities and devices,  depending on the targeted brain area or local pathology, and will be greatly  enhanced by new techniques for monitoring FUS efficacy.","2023-04-19","2024-03-06 16:57:30","2024-03-06T16:57:30Z","","1174-1190","","8","111","","Neuron","","","","","","","","eng","Copyright © 2023 Elsevier Inc. All rights reserved.","","","","","","Place: United States PMID: 36917978","","","","*Blood-Brain Barrier/diagnostic imaging; *Brain/diagnostic imaging; Animals; Biological Transport; Drug Delivery Systems/methods; Humans; Rats; Rats, Sprague-Dawley; Ultrasonography","","","","","","","","","","","","","","","","","","","","","","","","","","","","","","","","","","","","","","","","","","","","","","",""
