"YHDBILWA","journalArticle","2024","Deveney, C. M.; Surya, J. R.; Haroon, J. M.; Mahdavi, K. D.; Hoffman, K. R.; Enemuo, K. C.; Jordan, K. G.; Becerra, S. A.; Kuhn, T.; Bystritsky, A.; Jordan, S. E.","Transcranial focused ultrasound for the treatment of tremor: A preliminary case series.","Brain stimulation","","1876-4754","10.1016/j.brs.2023.12.007","","BACKGROUND: Essential tremor (ET) can be debilitating. Treatments for ET include beta-blockers and surgical interventions. Low-intensity focused ultrasound (LIFU)  may offer an office-based non-invasive alternative. OBJECTIVE: This pilot open  label clinical trial explores safety, feasibility, and potential efficacy of LIFU  in treatment of ET. METHODS: We report outcomes from the first 10 participants in  this IRB-approved trial of LIFU for treatment of ET. The ventral intermediate  nucleus of the thalamus (Vim) was targeted using structural and functional MRI.  Participants underwent eight 10-min sessions of LIFU targeting the contralateral  (Vim) to the most affected hand. Safety was closely monitored; Global Rating of  Change (GRC) and The Essential Tremor Rating Scale (TETRAS) scores were  collected. RESULTS: No adverse effects were reported. Eight participants reported  a GRC ≥2. TETRAS performance subscale demonstrated clinically significant  improvement in all participants. CONCLUSION: Preliminary findings support LIFU's  safety and feasibility. The potential efficacy encourages additional  sham-controlled studies.","2024-02","2024-03-06 16:57:30","2024-03-06T16:57:30Z","","35-38","","1","17","","Brain Stimul","","","","","","","","eng","Copyright © 2023 The Authors. Published by Elsevier Inc. All rights reserved.","","","","","","Place: United States PMID: 38128826","","","","*Essential Tremor/diagnostic imaging/therapy; *Tremor; Humans; Magnetic Resonance Imaging; Pilot Projects; Thalamus/diagnostic imaging; Treatment Outcome","","","","","","","","","","","","","","","","","","","","","","","","","","","","","","","","","","","","","","","","","","","","","","",""
"KLQA8G7C","journalArticle","2023","Liao, Min; Chen, Fan; Chen, Lin; Wu, Zihe; Huang, Jianbo; Pang, Houqing; Cheng, Chong; Wu, Zhe; Ma, Lang; Lu, Qiang","Synergistic Enzyme-Mimetic Catalysis-Based Non-Thermal Sonocavitation and Sonodynamic Therapy for Efficient Hypoxia Relief and Cancer Ablation.","Small (Weinheim an der Bergstrasse, Germany)","","1613-6829 1613-6810","10.1002/smll.202302744","","Non-invasive cancer treatment strategies that enable local non-thermal ablation, hypoxia relief, and reactive oxygen species (ROS) production to achieve  transiently destroying tumor tissue and long-term killing tumor cells would  greatly facilitate their clinical applications. However, continuously generating  oxygen cavitation nuclei, reducing the transient cavitation sound intensity  threshold, relieving hypoxia, and improving its controllability in the ablation  area still remains a significant challenge. Here, in this work, an Mn-coordinated  polyphthalocyanine sonocavitation agent (Mn-SCA) with large d-π-conjugated  network and atomic Mn-N sites is identified for the non-thermal sonocavitation  and sonodynamic therapy in the liver cancer ablation. In the tumor  microenvironment, the catalytical generation of oxygen assists cavitation  formation and generates microjets to ablate liver cancer tissue and relieve  hypoxia, this work reports for the first time to utilize the enzymatic properties  of Mn-SCA to lower the cavitation threshold in situ. Moreover, under pHIFU  irradiation, high reactive oxygen species (ROS) production can be achieved. The  two merits in liver cancer ablation are demonstrated by cell destruction and high  tumor inhibition efficiency. This work will help deepen the understanding of  cavitation ablation and the sonodynamic mechanisms related to the nanostructures  and guide the design of sonocavitation agents with high ROS production for solid  tumor ablation.","2023-10","2024-03-06 16:57:30","2024-03-06T16:57:30Z","","e2302744","","42","19","","Small","","","","","","","","eng","© 2023 Wiley-VCH GmbH.","","","","","","Place: Germany PMID: 37322373","","","","*High-Intensity Focused Ultrasound Ablation; *Liver Neoplasms/therapy; Catalysis; Cell Line, Tumor; Humans; Hypoxia; Oxygen; Reactive Oxygen Species; Tumor Microenvironment; cancer ablation; cavitation; histotripsy; pulsed high-intensity focused ultrasound; reactive oxygen species","","","","","","","","","","","","","","","","","","","","","","","","","","","","","","","","","","","","","","","","","","","","","","",""
"4CUIEAJ4","journalArticle","2023","Kim, Evgenii; Kim, Hyun-Chul; Van Reet, Jared; Böhlke, Mark; Yoo, Seung-Schik; Lee, Wonhye","Transcranial focused ultrasound-mediated unbinding of phenytoin from plasma proteins for suppression of chronic temporal lobe epilepsy in a rodent model.","Scientific reports","","2045-2322","10.1038/s41598-023-31383-4","","The efficacy of many anti-epileptic drugs, including phenytoin (PHT), is reduced by plasma protein binding (PPB) that sequesters therapeutically active drug  molecules within the bloodstream. An increase in systemic dose elevates the risk  of drug side effects, which demands an alternative technique to increase the  unbound concentration of PHT in a region-specific manner. We present a  low-intensity focused ultrasound (FUS) technique that locally enhances the  efficacy of PHT by transiently disrupting its binding to albumin. We first  identified the acoustic parameters that yielded the highest PHT unbinding from  albumin among evaluated parameter sets using equilibrium dialysis. Then, rats  with chronic mesial temporal lobe epilepsy (mTLE) received four sessions of PHT  injection, each followed by 30 min of FUS delivered to the ictal region, across  2 weeks. Two additional groups of mTLE rats underwent the same procedure, but  without receiving PHT or FUS. Assessment of electrographic seizure activities  revealed that FUS accompanying administration of PHT effectively reduced the  number and mean duration of ictal events compared to other conditions, without  damaging brain tissue or the blood-brain barrier. Our results demonstrated that  the FUS technique enhanced the anti-epileptic efficacy of PHT in a chronic mTLE  rodent model by region-specific PPB disruption.","2023-03-13","2024-03-06 16:57:30","2024-03-06T16:57:30Z","","4128","","1","13","","Sci Rep","","","","","","","","eng","© 2023. The Author(s).","","","","","","Place: England PMID: 36914775  PMCID: PMC10011522","","","","*Epilepsy, Temporal Lobe/chemically induced/drug therapy; *Phenytoin/pharmacology/therapeutic use; Animals; Anticonvulsants/therapeutic use; Blood Proteins/metabolism; Rats","","","","","","","","","","","","","","","","","","","","","","","","","","","","","","","","","","","","","","","","","","","","","","",""
"6MV4WC6F","journalArticle","2024","Golfrè Andreasi, Nico; Braccia, Arianna; Levi, Vincenzo; Rinaldo, Sara; Ghielmetti, Francesco; Cilia, Roberto; Romito, Luigi Michele; Bonvegna, Salvatore; Elia, Antonio Emanuele; Devigili, Grazia; Telese, Roberta; Colucci, Fabiana; Bruzzone, Maria Grazia; Messina, Giuseppe; Corradi, Marta; Stanziano, Mario; Caldiera, Valentina; Prioni, Sara; Amami, Paolo; Fusar Poli, Marco; Piacentini, Sylvie Hélène Marie Jeanne; Grisoli, Marina; Ciceri, Elisa Francesca Maria; DiMeco, Francesco; Eleopra, Roberto","The Optimal Targeting for Focused Ultrasound Thalamotomy Differs between Dystonic and Essential Tremor: A 12-Month Prospective Pilot Study.","Movement disorders clinical practice","","2330-1619","10.1002/mdc3.13911","","BACKGROUND: Magnetic resonance-guided focused ultrasound (MRgFUS) thalamotomy is increasingly used to treat drug-resistant essential tremor (ET). Data on MRgFUS  thalamotomy in dystonic tremor (DT) are anecdotal. OBJECTIVES: To investigate  efficacy, safety, and differences in target coordinates of MRgFUS thalamotomy in  DT versus ET. METHODS: Ten patients with DT and 35 with ET who consecutively  underwent MRgFUS thalamotomy were followed for 12 months. Although in both groups  the initial surgical planning coordinates corresponded to the ventralis  intermediate (Vim), the final target could be modified intraoperatively based on  clinical response. RESULTS: Tremor significantly improved in both groups. The  thalamic lesion was significantly more anterior in DT than ET. Considering both  ET and DT groups, the more anterior the lesion, the lower the odds ratio for  adverse events. CONCLUSIONS: MRgFUS thalamotomy is safe and effective in DT and  ET. Compared to classical Vim coordinates used for ET, more anterior targeting  should be considered for DT.","2024-01","2024-03-06 16:57:30","2024-03-06T16:57:30Z","","69-75","","1","11","","Mov Disord Clin Pract","","","","","","","","eng","© 2023 The Authors. Movement Disorders Clinical Practice published by Wiley Periodicals LLC on behalf of International Parkinson and Movement Disorder  Society.","","","","","","Place: United States PMID: 38291839  PMCID: PMC10828621","","","","*Essential Tremor/diagnostic imaging; Humans; MRgFUS; Pilot Projects; Prospective Studies; Thalamus/diagnostic imaging; Tremor; dystonia; dystonic tremor; essential tremor; thalamotomy","","","","","","","","","","","","","","","","","","","","","","","","","","","","","","","","","","","","","","","","","","","","","","",""
"X4M9FDXL","journalArticle","2023","Fujibayashi, Takumi; Koizumi, Norihiro; Nishiyama, Yu; Watanabe, Yusuke; Zhou, Jiayi; Matsuyama, Momoko; Yamada, Miyu; Tsumura, Ryosuke; Yoshinaka, Kiyoshi; Matsumoto, Naoki; Tsukihara, Hiroyuki; Numata, Kazushi","Study on method of organ section retention and tracking through deep learning in automated diagnostic and therapeutic robotics.","International journal of computer assisted radiology and surgery","","1861-6429 1861-6410","10.1007/s11548-023-02955-6","","PURPOSE: In high-intensity focused ultrasound (HIFU) treatment of the kidney and liver, tracking the organs is essential because respiratory motions make  continuous cauterization of the affected area difficult and may cause damage to  other parts of the body. In this study, we propose a tracking system for  rotational scanning, and propose and evaluate a method for estimating the angles  of organs in ultrasound images. METHODS: We proposed AEMA, AEMAD, and AEMAD++ as  methods for estimating the angles of organs in ultrasound images, using RUDS and  a phantom to acquire 90-degree images of a kidney from the long-axis image to the  short-axis image as a data set. Six datasets were used, with five for preliminary  preparation and one for testing, while the initial position was shifted by 2 mm  in the contralateral axis direction. The test data set was evaluated by  estimating the angle using each method. RESULTS: The accuracy and processing  speed of angle estimation for AEMA, AEMAD, and AEMAD++ were 23.8% and 0.33 FPS  for AEMAD, 32.0% and 0.56 FPS for AEMAD, and 29.5% and 3.20 FPS for AEMAD++, with  tolerance of ± 2.5 degrees. AEMAD++ offered the best speed and accuracy.  CONCLUSION: In the phantom experiment, AEMAD++ showed the effectiveness of  tracking the long-axis image of the kidney in rotational scanning. In the future,  we will add either the area of surrounding organs or the internal structure of  the kidney as a new feature to validate the results.","2023-11","2024-03-06 16:57:30","2024-03-06T16:57:30Z","","2101-2109","","11","18","","Int J Comput Assist Radiol Surg","","","","","","","","eng","© 2023. CARS.","","","","","","Place: Germany PMID: 37249747","","","","HIFU; Robotic ultrasound; Ultrasound image; Ultrasound-guided therapy","","","","","","","","","","","","","","","","","","","","","","","","","","","","","","","","","","","","","","","","","","","","","","",""
"SJZGPEPX","journalArticle","2023","Hu, Zhongtao; Yang, Yaoheng; Ye, Dezhuang; Chen, Si; Gong, Yan; Chukwu, Chinwendu; Chen, Hong","Targeted delivery of therapeutic agents to the mouse brain using a stereotactic-guided focused ultrasound device.","STAR protocols","","2666-1667","10.1016/j.xpro.2023.102132","","Existing protocols of focused ultrasound (FUS) combined with microbubble-mediated blood-brain barrier (BBB) opening (FUS-BBBO) in preclinical research require  expensive ultrasound equipment and complex operating procedures. We developed a  low-cost, easy-to-use, and precise FUS device for small animal models in  preclinical research. Here, we provide a detailed protocol for building the FUS  transducer, attaching the transducer to a stereotactic frame for precise brain  targeting, applying the integrated FUS device to perform FUS-BBBO in mice, and  evaluating the FUS-BBBO outcome. For complete details on the use and execution of  this protocol, please refer to Hu et al. (2022).(1).","2023-03-17","2024-03-06 16:57:30","2024-03-06T16:57:30Z","","102132","","1","4","","STAR Protoc","","","","","","","","eng","Copyright © 2023 The Authors. Published by Elsevier Inc. All rights reserved.","","","","","","Place: United States PMID: 36861835  PMCID: PMC9988659","","","","*Blood-Brain Barrier; *Brain/diagnostic imaging/surgery; Animals; Biological Transport; Biotechnology and bioengineering; Cancer; Health Sciences; Mice; Microbubbles; Neuroscience; Physics; Ultrasonography/methods","","","","","","","","","","","","","","","","","","","","","","","","","","","","","","","","","","","","","","","","","","","","","","",""
"X7KNXI2X","journalArticle","2023","Dai, Junyong; Wu, Yunfang; Chen, Ziqun; Xiao, Linkang; Zhang, Weili; Cao, Yang","Sonosensitive Phase-Changeable Nanoparticle Mediated Enhanced Chemotherapy in Prostate Cancer by Low-Intensity Focused Ultrasound.","International journal of molecular sciences","","1422-0067","10.3390/ijms24010825","","Prostate cancer (PCa) is one of the most common cancer types. Early detection of PC offers the best chance of successful treatment. A noninvasive, image-guided  therapy mediated by targeted nanoparticles (NPs) has the potential to improve the  efficacy and safety of cancer therapies. Herein, we report a sonosensitive  nanoparticle modified with anti-PSMA (prostate-specific membrane antigen)  antibodies to activate target prostate tumors. These nanoparticles  (PFP@IR780@PTX@liposome NPs) were co-loaded with the chemotherapeutic agent  docetaxel and the sonosensitizer IR780, as well as phase-changeable  perfluorocarbon (PFC) liquids. The liquid-gas phase change could be induced by  low-intensity focused ultrasound (LIFU) in vitro. We found that the  PFP@IR780@PTX@liposome NPs can specifically accumulate in prostate tumors after  LIFU irradiation, as monitored by ultrasound and photoacoustic imaging.  Meanwhile, docetaxel was controllably released from the nanoparticles to achieve  enhanced chemotherapeutic therapy in vivo. These sonosensitive phase-changeable  NPs can visually treat prostate cancers effectively and have a clinical  potential.","2023-01-03","2024-03-06 16:57:30","2024-03-06T16:57:30Z","","","","1","24","","Int J Mol Sci","","","","","","","","eng","","","","","","","Place: Switzerland PMID: 36614265  PMCID: PMC9821565","","","","*Nanoparticles; *Prostatic Neoplasms/diagnostic imaging/drug therapy; Cell Line, Tumor; Docetaxel; Humans; Liposomes; Male; chemotherapy; low-intensity focused ultrasound; phase-changeable nanoparticles; prostate cancer","","","","","","","","","","","","","","","","","","","","","","","","","","","","","","","","","","","","","","","","","","","","","","",""
"GNSN8ZDA","journalArticle","2023","Feng, Lian; Shi, Xinwang; Zhou, Fang; Chen, Yanhua; Zhou, Xiaowei","Technical note: Evaluation of the acoustic radiation force imaging for predicting HIFU focus with in vitro and ex vivo experiments.","Medical physics","","2473-4209 0094-2405","10.1002/mp.16565","","BACKGROUND: High-intensity focused ultrasound (HIFU) is currently used for the treatment of various diseases, but it still lacks a reliable technique in the  preoperative stage to accurately place its ""energy blade"" onto diseased targets.  Acoustic radiation force imaging (ARFI) was recently introduced to tackle this  issue, but its applicability and limitations were not clear. PURPOSE: The aim of  this study was to evaluate the performance of ARFI method in prediction of HIFU  focal location at the preoperative stage. METHODS: A point spread function (PSF)  localization method, which was borrowed from the ultrasound super resolution  field, was used to validate the core autocorrelation-based motion estimation  algorithm in the ARFI procedure. Accuracy of the ARFI method for estimating the  HIFU focus were tested with in vitro and ex vivo experiments with a clinically  equivalent HIFU system. Comparisons were made between the estimated focal  locations and those of the damaged area after the testing objects were cut open.  RESULTS: Results showed that the PSF localization was able to serve as a  validating method for motion detection only when the tissue displacement was  large. With the ARFI method, location of the HIFU focus could be accurately  predicted by a 2D motion map preoperatively, and the axial spatial errors were  less than 0.5 mm. However, the derived 2D motion maps can only be valuable when  the acoustic stimulation in ARFI were strong enough, which was probably due to  the fact that the HIFU focal locations were at large depths and the ultrasound  imaging signal had low signal to noise ratio. CONCLUSION: The ARFI method was  indeed an accurate technique for preoperatively predicting HIFU focus in vitro  and ex vivo. If clinical applications were to be considered, particularly in deep  tissues, efforts might need to be made to improve ability of the ultrasound  motion estimation technique.","2023-09","2024-03-06 16:57:30","2024-03-06T16:57:30Z","","5449-5459","","9","50","","Med Phys","","","","","","","","eng","© 2023 American Association of Physicists in Medicine.","","","","","","Place: United States PMID: 37345709","","","","*High-Intensity Focused Ultrasound Ablation/methods; *Mechanical Phenomena; Acoustics; Ultrasonography; acoustic radiation force imaging; high-intensity focused ultrasound; motion estimation; surgery planning","","","","","","","","","","","","","","","","","","","","","","","","","","","","","","","","","","","","","","","","","","","","","","",""
"HAK53VM5","journalArticle","2023","Attali, David; Tiennot, Thomas; Schafer, Mark; Fouragnan, Elsa; Sallet, Jérôme; Caskey, Charles F.; Chen, Robert; Darmani, Ghazaleh; Bubrick, Ellen J.; Butler, Christopher; Stagg, Charlotte J.; Klein-Flügge, Miriam; Verhagen, Lennart; Yoo, Seung-Schik; Pauly, Kim Butts; Aubry, Jean-Francois","Three-layer model with absorption for conservative estimation of the maximum acoustic transmission coefficient through the human skull for transcranial  ultrasound stimulation.","Brain stimulation","","1876-4754","10.1016/j.brs.2022.12.005","","Transcranial ultrasound stimulation (TUS) has been shown to be a safe and effective technique for non-invasive superficial and deep brain stimulation. Safe  and efficient translation to humans requires estimating the acoustic attenuation  of the human skull. Nevertheless, there are no international guidelines for  estimating the impact of the skull bone. A tissue independent, arbitrary derating  was developed by the U.S. Food and Drug Administration to take into account  tissue absorption (0.3 dB/cm-MHz) for diagnostic ultrasound. However, for the  case of transcranial ultrasound imaging, the FDA model does not take into account  the insertion loss induced by the skull bone, nor the absorption by brain tissue.  Therefore, the estimated absorption is overly conservative which could  potentially limit TUS applications if the same guidelines were to be adopted.  Here we propose a three-layer model including bone absorption to calculate the  maximum pressure transmission through the human skull for frequencies ranging  between 100 kHz and 1.5 MHz. The calculated pressure transmission decreases with  the frequency and the thickness of the bone, with peaks for each thickness  corresponding to a multiple of half the wavelength. The 95th percentile maximum  transmission was calculated over the accessible surface of 20 human skulls for 12  typical diameters of the ultrasound beam on the skull surface, and varies between  40% and 78%. To facilitate the safe adjustment of the acoustic pressure for short  ultrasound pulses, such as transcranial imaging or transcranial ultrasound  stimulation, a table summarizes the maximum pressure transmission for each  ultrasound beam diameter and each frequency.","2023-02","2024-03-06 16:57:30","2024-03-06T16:57:30Z","","48-55","","1","16","","Brain Stimul","","","","","","","","eng","Copyright © 2022. Published by Elsevier Inc.","","","","","","Place: United States PMID: 36549480","","","","*Brain; *Skull/diagnostic imaging; Acoustics; Focused ultrasound neuromodulation (FUN); Head; Humans; Low-intensity focused ultrasound (LIFUS); Transcranial focused ultrasound (tFUS); Transcranial pulsed ultrasound (TPS); Transcranial ultrasound stimulation (TUS); Ultrasonic neuromodulation (UNMOD); Ultrasonography","","","","","","","","","","","","","","","","","","","","","","","","","","","","","","","","","","","","","","","","","","","","","","",""
"BPZ986IB","preprint","2023","Kosnoff, Joshua; Yu, Kai; Liu, Chang; He, Bin","Transcranial Focused Ultrasound to V5 Enhances Human Visual Motion Brain-Computer Interface by Modulating Feature-Based Attention.","","","","10.1101/2023.09.04.556252","","Paralysis affects roughly 1 in 50 Americans. While there is no cure for the condition, brain-computer interfaces (BCI) can allow users to control a device  with their mind, bypassing the paralyzed region. Non-invasive BCIs still have  high error rates, which is hypothesized to be reduced with concurrent targeted  neuromodulation. This study examines whether transcranial focused ultrasound  (tFUS) modulation can improve BCI outcomes, and what the underlying mechanism of  action might be through high-density electroencephalography (EEG)-based source  imaging (ESI) analyses. V5-targeted tFUS significantly reduced the error for the  BCI speller task. ESI analyses showed significantly increased theta activity in  the tFUS condition at both V5 and downstream the dorsal visual processing  pathway. Correlation analysis indicates that the dorsal processing pathway  connection was preserved during tFUS stimulation, whereas extraneous connections  were severed. These results suggest that V5-targeted tFUS' mechanism of action is  to raise the brain's feature-based attention to visual motion.","2023-09-05","2024-03-06 16:57:30","2024-03-06T16:57:30Z","","","","","","","","","","","","","","United States","eng","","","","","","","Journal Abbreviation: bioRxiv Pages: 2023.09.04.556252 Publication Title: bioRxiv : the preprint server for biology PMID: 37732253  PMCID: PMC10508752","","","","","","","","","","","","","","","","","","","","","","","","","","","","","","","","","","","","","","","","","","","","","","","","","","",""
"XZJLKXD8","journalArticle","2023","Zhang, Hao; Zhang, Yanqiu; Wang, Xue; Chen, Guowei; Jian, Xiqi; Xu, Minpeng; Ming, Dong","Transcranial dipole localization and decoding study based on ultrasonic phased array for acoustoelectric brain imaging.","Journal of neural engineering","","1741-2552","10.1088/1741-2552/ad08f5","","Objective. Neuroimaging is one of the effective tools to understand the functional activities of the brain, but traditional non-invasive neuroimaging  techniques are difficult to combine both high temporal and spatial resolution to  satisfy clinical needs. Acoustoelectric brain imaging (ABI) can combine the  millimeter spatial resolution advantage of focused ultrasound with the  millisecond temporal resolution advantage of electroencephalogram  signals.Approach. In this study, we first explored the transcranial modulated  acoustic field distribution based on ABI, and further localized and decoded  single and double dipoles signals.Main results. The results show that the  simulation-guided acoustic field modulation results are significantly better than  those of self-focusing, which can realize precise modulation focusing of  intracranial target focusing. The single dipole transcranial localization error  is less than 0.4 mm and the decoding accuracy is greater than 0.93. The double  dipoles transcranial localization error is less than 0.2 mm and the decoding  accuracy is greater than 0.89.Significance. This study enables precise focusing  of transcranial acoustic field modulation, high-precision localization of source  signals and decoding of their waveforms, which provides a technical method for  ABI in localizing evoked excitatory neuron areas and epileptic focus.","2023-11-09","2024-03-06 16:57:30","2024-03-06T16:57:30Z","","","","6","20","","J Neural Eng","","","","","","","","eng","Creative Commons Attribution license.","","","","","","Place: England PMID: 37918024","","","","*Brain/diagnostic imaging; *Ultrasonics; Computer Simulation; Electroencephalography; Neuroimaging; acoustoelectric brain imaging; decoding; electroencephalogram; focused ultrasound; localization","","","","","","","","","","","","","","","","","","","","","","","","","","","","","","","","","","","","","","","","","","","","","","",""
